"Date and Timestamp";"Title";"Full Text";"Source";"Link"
"2025-04-26 07:48:57";"Plancorp LLC Purchases 2,873 Shares of NVIDIA Co. (NASDAQ:NVDA)";"  Plancorp LLC raised its position in shares of  NVIDIA Co. (NASDAQ:NVDA – Free Report) by 6.3% during the 4th quarter, according to its most recent 13F filing with the Securities and Exchange Commission (SEC). The institutional investor  owned 48,780 shares of the computer hardware maker’s stock after acquiring an additional 2,873 shares during the period. Plancorp LLC’s holdings in NVIDIA were worth $6,551,000 as of its most recent filing with the Securities and Exchange Commission (SEC).  A number of other hedge funds and other institutional investors have also recently modified their holdings of the company. Clear Street Derivatives LLC purchased a new position in  NVIDIA in the third quarter worth about $4,589,905,000.  Proficio Capital Partners LLC boosted its holdings in shares of  NVIDIA by 14,641.2% in the 4th quarter. Proficio Capital Partners LLC now owns 34,676,316 shares of the computer hardware maker’s stock worth $4,656,682,000 after purchasing an additional 34,441,082 shares during the period.  Amundi increased its position in shares of  NVIDIA by 12.9% during the 4th quarter. Amundi now owns 117,036,612 shares of the computer hardware maker’s stock valued at $16,394,224,000 after purchasing an additional 13,406,054 shares during the last quarter.  Geode Capital Management LLC raised its holdings in  NVIDIA by 2.2% during the 3rd quarter. Geode Capital Management LLC now owns 546,079,492 shares of the computer hardware maker’s stock valued at $66,101,133,000 after buying an additional 11,525,969 shares during the period.  Finally, UBS AM a distinct business unit of UBS ASSET MANAGEMENT AMERICAS LLC lifted its position in  NVIDIA by 3.8% in the third quarter. UBS AM a distinct business unit of UBS ASSET MANAGEMENT AMERICAS LLC now owns 180,403,789 shares of the computer hardware maker’s stock worth $21,908,236,000 after buying an additional 6,526,200 shares during the last quarter. 65.27% of the stock is currently owned by institutional investors.     Get NVIDIA alerts:    NVIDIA Stock Up 4.3 % NASDAQ:NVDA opened at $111.01 on Friday. The stock’s fifty day moving average is $113.21 and its two-hundred day moving average is $129.01. NVIDIA Co. has a 52 week low of $81.25 and a 52 week high of $195.95. The company has a quick ratio of 3.64, a current ratio of 4.10 and a debt-to-equity ratio of 0.13. The stock has a market capitalization of $2.71 trillion, a price-to-earnings ratio of 43.69, a price-to-earnings-growth ratio of 1.76 and a beta of 1.96.         Want More Great Investing Ideas?  10 Stocks to Sell NOW! 3 Stocks to DOUBLE This Year The 10 Best Stocks to Own in 2023 7 Stocks to Buy and Hold Forever     							                   NVIDIA (NASDAQ:NVDA – Get Free Report) last issued its quarterly earnings results on Wednesday, February 26th. The computer hardware maker reported $0.89 EPS for the quarter, beating the consensus estimate of $0.84 by $0.05. NVIDIA had a net margin of 55.69% and a return on equity of 114.83%. The company had revenue of $39.33 billion during the quarter, compared to analysts’ expectations of $38.16 billion.  Research analysts anticipate that  NVIDIA Co. will post 2.77 EPS for the current year.  NVIDIA Announces Dividend The company also recently declared a quarterly dividend, which was paid on Wednesday, April 2nd. Shareholders of record on Wednesday, March 12th were issued a dividend of $0.01 per share. This represents a $0.04 annualized dividend and a yield of 0.04%. The ex-dividend date of this dividend  was Wednesday, March 12th. NVIDIA’s dividend payout ratio (DPR) is presently 1.36%.  Insider Transactions at NVIDIA In other NVIDIA news, Director Aarti S. Shah sold 20,000 shares of the business’s stock in a transaction that occurred on Thursday, March 20th. The stock was sold at an average price of $118.42, for a total value of $2,368,400.00. Following the completion of the sale, the director now owns 53,208 shares in the company, valued at approximately $6,300,891.36. The trade was a 27.32 % decrease in their ownership of the stock. The sale was disclosed in a filing with the Securities & Exchange Commission, which can be accessed through this hyperlink. Also, CFO Colette Kress sold 66,660 shares of NVIDIA stock in a transaction on Friday, March 21st. The shares were sold at an average price of $116.83, for a total transaction of $7,787,887.80. Following the completion of the transaction, the chief financial officer now owns 3,085,765 shares in the company, valued at approximately $360,509,924.95. This represents a 2.11 % decrease in their ownership of the stock. The disclosure for this sale can be found here. In the last three months, insiders sold 147,147 shares of company stock valued at $17,133,207. Insiders own  4.23% of the company’s stock.  Wall Street Analyst Weigh In Several equities analysts recently commented on NVDA shares. Rosenblatt Securities cut their price target on shares of NVIDIA from $220.00 to $200.00 and set a “buy” rating on the stock in a report on Wednesday, April 16th. William Blair  reiterated an “outperform” rating on shares of NVIDIA in a research note on Thursday, March 20th. Stifel Nicolaus  set a $180.00 target price on shares of NVIDIA in a research note on Wednesday, March 19th. Mizuho reduced their price target on shares of NVIDIA from $175.00 to $168.00 and set an “outperform” rating on the stock in a research note on Friday, March 14th. Finally, KeyCorp  set a $190.00 price objective on shares of NVIDIA in a research report on Wednesday, March 19th. Six investment analysts have rated the stock with a hold rating, thirty-six have given a buy rating and two have given a strong buy rating to the stock. According to data from MarketBeat, NVIDIA presently has a consensus rating of “Moderate Buy” and a consensus price target of $164.96. Get Our Latest Analysis on NVIDIA About NVIDIA  (Free Report) NVIDIA Corporation provides graphics and compute and networking solutions in the United States, Taiwan, China, Hong Kong, and internationally. The Graphics segment offers GeForce GPUs for gaming and PCs, the GeForce NOW game streaming service and related infrastructure, and solutions for gaming platforms; Quadro/NVIDIA RTX GPUs for enterprise workstation graphics; virtual GPU or vGPU software for cloud-based visual and virtual computing; automotive platforms for infotainment systems; and Omniverse software for building and operating metaverse and 3D internet applications. Read More  Five stocks we like better than NVIDIA Pros And Cons Of Monthly Dividend Stocks Short Sellers Gave Up on These 3 Names Recently How to start investing in penny stocks 3 Boring Stocks Outperforming the Market This Year What Are the U.K. Market Holidays? How to Invest and Trade If You Wanted To Buy AbbVie and Didn’t, There’s Still Time To Buy   Want to see what other hedge funds are holding NVDA? Visit HoldingsChannel.com to get the latest 13F filings and insider trades for NVIDIA Co. (NASDAQ:NVDA – Free Report).        Receive News & Ratings for NVIDIA Daily - Enter your email address below to receive a concise daily summary of the latest news and analysts' ratings for NVIDIA and related companies with MarketBeat.com's FREE daily email newsletter.        ";"News";"https://www.etfdailynews.com/2025/04/26/plancorp-llc-purchases-2873-shares-of-nvidia-co-nasdaqnvda/"
"2025-04-26 07:48:57";"Intellus Advisors LLC Purchases Shares of 45,893 NVIDIA Co. (NASDAQ:NVDA)";"  Intellus Advisors LLC acquired a new stake in  NVIDIA Co. (NASDAQ:NVDA – Free Report) in the 4th quarter, Holdings Channel reports. The firm acquired 45,893 shares of the computer hardware maker’s stock, valued at approximately $6,163,000. NVIDIA makes up   1.1% of Intellus Advisors LLC’s holdings, making the stock its 26th biggest position.  Other institutional investors and hedge funds have also made changes to their positions in the company. Geode Capital Management LLC grew its holdings in  NVIDIA by 2.2% during the 3rd quarter. Geode Capital Management LLC now owns 546,079,492 shares of the computer hardware maker’s stock worth $66,101,133,000 after acquiring an additional 11,525,969 shares in the last quarter.  UBS AM a distinct business unit of UBS ASSET MANAGEMENT AMERICAS LLC lifted its position in shares of  NVIDIA by 3.8% during the 3rd quarter. UBS AM a distinct business unit of UBS ASSET MANAGEMENT AMERICAS LLC now owns 180,403,789 shares of the computer hardware maker’s stock worth $21,908,236,000 after purchasing an additional 6,526,200 shares during the last quarter.  Charles Schwab Investment Management Inc. grew its stake in shares of  NVIDIA by 3.6% during the fourth quarter. Charles Schwab Investment Management Inc. now owns 151,280,130 shares of the computer hardware maker’s stock worth $20,315,409,000 after purchasing an additional 5,211,040 shares in the last quarter.  Amundi increased its holdings in  NVIDIA by 12.9% in the fourth quarter. Amundi now owns 117,036,612 shares of the computer hardware maker’s stock valued at $16,394,224,000 after buying an additional 13,406,054 shares during the last quarter.  Finally, Fisher Asset Management LLC lifted its holdings in  NVIDIA by 1.7% during the 4th quarter. Fisher Asset Management LLC now owns 98,339,379 shares of the computer hardware maker’s stock worth $13,205,995,000 after buying an additional 1,618,672 shares during the last quarter. 65.27% of the stock is owned by institutional investors and hedge funds.     Get NVIDIA alerts:    Insider Activity In other NVIDIA news, Director Robert K. Burgess sold 53,324 shares of NVIDIA stock in a transaction on Thursday, March 13th. The shares were sold at an average price of $115.49, for a total value of $6,158,388.76. Following the completion of the transaction, the director now owns 251,044 shares of the company’s stock, valued at $28,993,071.56. The trade was a 17.52 % decrease in their ownership of the stock. The transaction was disclosed in a document filed with the SEC, which is available through this link. Also, CFO Colette Kress sold 66,660 shares of the firm’s stock in a transaction dated Friday, March 21st. The stock was sold at an average price of $116.83, for a total transaction of $7,787,887.80. Following the completion of the transaction, the chief financial officer now owns 3,085,765 shares in the company, valued at approximately $360,509,924.95. The trade was a 2.11 % decrease in their ownership of the stock. The disclosure for this sale can be found here. Insiders have sold 147,147 shares of company stock worth $17,133,207 over the last 90 days. Company insiders own  4.23% of the company’s stock.  Analyst Upgrades and Downgrades        Want More Great Investing Ideas?  10 Stocks to Sell NOW! 3 Stocks to DOUBLE This Year The 10 Best Stocks to Own in 2023 7 Stocks to Buy and Hold Forever     							                   A number of research firms have recently commented on NVDA. TD Cowen dropped their price objective on NVIDIA from $175.00 to $140.00 and set a “buy” rating on the stock in a report on Wednesday, April 9th. Mizuho dropped their price target on shares of NVIDIA from $175.00 to $168.00 and set an “outperform” rating on the stock in a research note on Friday, March 14th. Bank of America dropped their price objective on NVIDIA from $200.00 to $160.00 and set a “buy” rating on the stock in a report on Wednesday, April 16th. Barclays decreased their price target on shares of NVIDIA from $175.00 to $155.00 and set an “overweight” rating for the company in a research note on Tuesday. Finally, Wedbush  reiterated an “outperform” rating and issued a $175.00 price objective on shares of NVIDIA in a research report on Wednesday, April 16th. Six research analysts have rated the stock with a hold rating, thirty-six have given a buy rating and two have assigned  a strong buy rating to the company. According to MarketBeat, NVIDIA  has a consensus rating of “Moderate Buy” and a consensus price target of $164.96. View Our Latest Stock Analysis on NVDA NVIDIA Price Performance NVDA stock opened at $111.01 on Friday. The stock’s fifty day simple moving average is $113.21 and its 200-day simple moving average is $129.01. NVIDIA Co. has a 52-week low of $81.25 and a 52-week high of $195.95. The stock has a market capitalization of $2.71 trillion, a price-to-earnings ratio of 43.69, a price-to-earnings-growth ratio of 1.76 and a beta of 1.96. The company has a quick ratio of 3.64, a current ratio of 4.10 and a debt-to-equity ratio of 0.13.  NVIDIA (NASDAQ:NVDA – Get Free Report) last posted its quarterly earnings data on Wednesday, February 26th. The computer hardware maker reported $0.89 EPS for the quarter, beating analysts’ consensus estimates of $0.84 by $0.05. The company had revenue of $39.33 billion during the quarter, compared to the consensus estimate of $38.16 billion. NVIDIA had a net margin of 55.69% and a return on equity of 114.83%.  Equities research analysts expect that  NVIDIA Co. will post 2.77 EPS for the current year.  NVIDIA Announces Dividend The business also recently disclosed a quarterly dividend, which was paid on Wednesday, April 2nd. Shareholders of record on Wednesday, March 12th were paid a dividend of $0.01 per share. This represents a $0.04 dividend on an annualized basis and a dividend yield of 0.04%. The ex-dividend date  was Wednesday, March 12th. NVIDIA’s dividend payout ratio  is presently 1.36%.  NVIDIA Company Profile  (Free Report) NVIDIA Corporation provides graphics and compute and networking solutions in the United States, Taiwan, China, Hong Kong, and internationally. The Graphics segment offers GeForce GPUs for gaming and PCs, the GeForce NOW game streaming service and related infrastructure, and solutions for gaming platforms; Quadro/NVIDIA RTX GPUs for enterprise workstation graphics; virtual GPU or vGPU software for cloud-based visual and virtual computing; automotive platforms for infotainment systems; and Omniverse software for building and operating metaverse and 3D internet applications. Featured Stories  Five stocks we like better than NVIDIA Insider Buying Explained: What Investors Need to Know Short Sellers Gave Up on These 3 Names Recently What Are the FAANG Stocks and Are They Good Investments? 3 Boring Stocks Outperforming the Market This Year What Are Dividend Challengers? If You Wanted To Buy AbbVie and Didn’t, There’s Still Time To Buy   Want to see what other hedge funds are holding NVDA? Visit HoldingsChannel.com to get the latest 13F filings and insider trades for NVIDIA Co. (NASDAQ:NVDA – Free Report).        Receive News & Ratings for NVIDIA Daily - Enter your email address below to receive a concise daily summary of the latest news and analysts' ratings for NVIDIA and related companies with MarketBeat.com's FREE daily email newsletter.        ";"News";"https://www.etfdailynews.com/2025/04/26/intellus-advisors-llc-purchases-shares-of-45893-nvidia-co-nasdaqnvda/"
"2025-04-26 07:49:05";"Umpqua Bank Trims Stock Holdings in NVIDIA Co. (NASDAQ:NVDA)";"  Umpqua Bank cut its position in  NVIDIA Co. (NASDAQ:NVDA – Free Report) by 2.9% in the 4th quarter, Holdings Channel.com reports. The firm owned 77,914 shares of the computer hardware maker’s stock after selling 2,321 shares during the period. NVIDIA makes up   3.6% of Umpqua Bank’s portfolio, making the stock its 5th biggest holding. Umpqua Bank’s holdings in NVIDIA were worth $10,266,000 at the end of the most recent reporting period.  A number of other hedge funds have also recently made changes to their positions in the company. Geode Capital Management LLC raised its position in  NVIDIA by 2.2% during the 3rd quarter. Geode Capital Management LLC now owns 546,079,492 shares of the computer hardware maker’s stock worth $66,101,133,000 after purchasing an additional 11,525,969 shares during the last quarter.  UBS AM a distinct business unit of UBS ASSET MANAGEMENT AMERICAS LLC increased its stake in shares of  NVIDIA by 3.8% in the third quarter. UBS AM a distinct business unit of UBS ASSET MANAGEMENT AMERICAS LLC now owns 180,403,789 shares of the computer hardware maker’s stock valued at $21,908,236,000 after buying an additional 6,526,200 shares during the period.  Charles Schwab Investment Management Inc. raised its position in shares of  NVIDIA by 3.6% during the fourth quarter. Charles Schwab Investment Management Inc. now owns 151,280,130 shares of the computer hardware maker’s stock worth $20,315,409,000 after acquiring an additional 5,211,040 shares during the last quarter.  Amundi lifted its stake in shares of  NVIDIA by 12.9% in the fourth quarter. Amundi now owns 117,036,612 shares of the computer hardware maker’s stock worth $16,394,224,000 after acquiring an additional 13,406,054 shares during the period.  Finally, Fisher Asset Management LLC boosted its holdings in  NVIDIA by 1.7% in the fourth quarter. Fisher Asset Management LLC now owns 98,339,379 shares of the computer hardware maker’s stock valued at $13,205,995,000 after acquiring an additional 1,618,672 shares during the last quarter. 65.27% of the stock is owned by institutional investors and hedge funds.     Get NVIDIA alerts:    NVIDIA Stock Performance Shares of NVIDIA stock opened at $111.01 on Friday. The business’s fifty day simple moving average is $113.21 and its 200 day simple moving average is $129.01. The company has a current ratio of 4.10, a quick ratio of 3.64 and a debt-to-equity ratio of 0.13. NVIDIA Co. has a 12 month low of $81.25 and a 12 month high of $195.95. The firm has a market capitalization of $2.71 trillion, a P/E ratio of 43.69, a price-to-earnings-growth ratio of 1.76 and a beta of 1.96.         Want More Great Investing Ideas?  10 Stocks to Sell NOW! 3 Stocks to DOUBLE This Year The 10 Best Stocks to Own in 2023 7 Stocks to Buy and Hold Forever     							                   NVIDIA (NASDAQ:NVDA – Get Free Report) last released its earnings results on Wednesday, February 26th. The computer hardware maker reported $0.89 EPS for the quarter, topping analysts’ consensus estimates of $0.84 by $0.05. The company had revenue of $39.33 billion for the quarter, compared to analysts’ expectations of $38.16 billion. NVIDIA had a return on equity of 114.83% and a net margin of 55.69%.  As a group, analysts anticipate that  NVIDIA Co. will post 2.77 EPS for the current year.  NVIDIA Announces Dividend The business also recently declared a quarterly dividend, which was paid on Wednesday, April 2nd. Stockholders of record on Wednesday, March 12th were paid a dividend of $0.01 per share. The ex-dividend date  was Wednesday, March 12th. This represents a $0.04 annualized dividend and a dividend yield of 0.04%. NVIDIA’s payout ratio is currently 1.36%.  Insider Activity at NVIDIA In related news, insider Donald F. Robertson, Jr. sold 4,500 shares of the business’s stock in a transaction dated Friday, March 21st. The stock was sold at an average price of $116.80, for a total value of $525,600.00. Following the sale, the insider now directly owns 479,428 shares in the company, valued at approximately $55,997,190.40. The trade was a 0.93 % decrease in their position. The sale was disclosed in a legal filing with the SEC, which is accessible through this hyperlink. Also, Director John Dabiri sold 2,663 shares of the stock in a transaction dated Monday, March 10th. The stock was sold at an average price of $110.00, for a total transaction of $292,930.00. Following the transaction, the director now owns 17,279 shares of the company’s stock, valued at $1,900,690. This represents a 13.35 % decrease in their position. The disclosure for this sale can be found here. Over the last quarter, insiders have sold 147,147 shares of company stock worth $17,133,207. Insiders own  4.23% of the company’s stock.  Wall Street Analyst Weigh In Several research firms have issued reports on NVDA. Citigroup  restated a “buy” rating on shares of NVIDIA in a report on Wednesday, April 16th. Raymond James  reiterated a “strong-buy” rating on shares of NVIDIA in a report on Wednesday, April 16th. DA Davidson dropped their price objective on NVIDIA from $125.00 to $120.00 and set a “neutral” rating on the stock in a research note on Monday, April 14th. HSBC cut NVIDIA from a “buy” rating to a “hold” rating and set a $120.00 target price for the company. in a research note on Thursday, April 3rd. Finally, TD Cowen dropped their price target on NVIDIA from $175.00 to $140.00 and set a “buy” rating on the stock in a research note on Wednesday, April 9th. Six analysts have rated the stock with a hold rating, thirty-six have issued  a buy rating and two have issued  a strong buy rating to the stock. Based on data from MarketBeat.com, the company presently has a consensus rating of “Moderate Buy” and an average target price of $164.96. Read Our Latest Stock Analysis on NVIDIA NVIDIA Company Profile  (Free Report) NVIDIA Corporation provides graphics and compute and networking solutions in the United States, Taiwan, China, Hong Kong, and internationally. The Graphics segment offers GeForce GPUs for gaming and PCs, the GeForce NOW game streaming service and related infrastructure, and solutions for gaming platforms; Quadro/NVIDIA RTX GPUs for enterprise workstation graphics; virtual GPU or vGPU software for cloud-based visual and virtual computing; automotive platforms for infotainment systems; and Omniverse software for building and operating metaverse and 3D internet applications. See Also  Five stocks we like better than NVIDIA 3 Ways To Invest In Coffee, Other Than Drinking It Short Sellers Gave Up on These 3 Names Recently What is a Microcap Stock? Everything You Need to Know  3 Boring Stocks Outperforming the Market This Year Stock Ratings and Recommendations: Understanding Analyst Ratings If You Wanted To Buy AbbVie and Didn’t, There’s Still Time To Buy   Want to see what other hedge funds are holding NVDA? Visit HoldingsChannel.com to get the latest 13F filings and insider trades for NVIDIA Co. (NASDAQ:NVDA – Free Report).        Receive News & Ratings for NVIDIA Daily - Enter your email address below to receive a concise daily summary of the latest news and analysts' ratings for NVIDIA and related companies with MarketBeat.com's FREE daily email newsletter.        ";"News";"https://www.etfdailynews.com/2025/04/26/umpqua-bank-trims-stock-holdings-in-nvidia-co-nasdaqnvda/"
