"Date and Timestamp";"Title";"Full Text";"Source";"Link"
"2025-04-25 16:49:26";"AbbVie Stock Rises on Stronger-Than-Expected Results, Profit Outlook Lift";"AbbVie (ABBV) on Friday reported first-quarter results that came in above analysts' estimates, and lifted its full-year profit guidance. The drugmaker generated adjustedearnings per share (EPS)of $2.46 on revenue that rose 8% year-over-year to $13.34 billion. Analysts polled by Visible Alpha expected $2.40 and $12.92 billion, respectively. Sales of Skyrizi and Rinvoq soared more than 70% and 57%, respectively, but those of Humira fell by half. The three immunology drugs made up nearly half of AbbVie's Q1 revenue at a combined $6.26 billion. AbbVie lifted its full-year adjusted EPS profit forecast to a range of $12.09 to $12.29 from the prior $11.99 to $12.19. The company said its current outlook is ""based on the existing trade environment and does not reflect any trade policy shifts, including pharmaceutical sector tariffs, that could impact AbbVie's business."" President Trumphas saidthat he plans to place tariffs on the drug industry, which were exempted from the first round of tariffsannounced earlier this month. AbbVie shares, which entered the day 1.5% higher this year, were up nearly 3% early Friday afternoon.";"News";"https://www.investopedia.com/abbvie-stock-rises-on-stronger-than-expected-results-profit-outlook-lift-11721905"
"2025-04-25 17:01:06";"Intel Slumps on a Soft Outlook. Wall Street Is Waiting To See Its Turnaround Take Shape.";"Intel (INTC) shares tumbled Friday after the company’s quarterly forecastmissed expectations, despite stronger-than-expected results for the first quarter. The stock slid about 7% to $19.98 in recent trading, and has lost over a third of its value in the past 12 months. (ReadInvestopedia'slive coverage oftoday's market action here.) Jefferies said, “there aren’t many bright spots to point to” for the struggling chipmaker, which is moving forward with a turnaround effort led by CEO Lip-Bu Tan, whotook overin March. “It will take a long time for Lip-Bu to put his stamp on INTC,” the analysts said, adding ""we'll continue to sit on the sidelines until we have a better vision of the turnaround.” Jefferies maintained a “hold” rating and $23 price target for the stock. Tan said Thursday that “there are no quick fixes,” and that he is ""taking swift actions to drive better execution and operational efficiency,"" including plans to further trim Intel's ranks. Bank of America analysts said they believe the new CEO is taking the “right actions.”However, the company’s large size, unprofitable foundry arm, and strong roster of competitors like Nvidia (NVDA) and Advanced Micro Devices (AMD) “make it tougher to turn things around in the next few years,” they said. The bank kept its “neutral” rating and $23 target, but lowered its earnings estimates for 2025 and 2026. Citi and Wedbush analysts also issued neutral ratings, with price targets of $21 and $19, respectively.";"News";"https://www.investopedia.com/intel-slumps-on-a-soft-outlook-wall-street-is-waiting-to-see-its-turnaround-take-shape-11722154"
"2025-04-25 17:23:09";"Charter Communications Stock Leads S&P 500 as Subscriber Figures Top Estimates";"Charter Communications (CHTR) stock soared 11% to leadS&P 500gainers Friday after the company added more mobile phone lines and lost fewer video customers than analysts had expected in the first quarter. The owner of Spectrum cable, internet, and phone services generated $13.74 billion in revenue, up slightly year-over-year and above the $13.68 billion Visible Alpha forecast.Earnings per share (EPS)came in at $8.42, up nearly 12% from the year-ago quarter but still 7 cents shy of estimates. Charter added 514,000 mobile phone lines in the quarter, better than the roughly 477,000 that analysts were expecting. The company lost 60,000 internet subscribers, more than expected, but about 9,000 of those losses were due to the Januarywildfires in California. The company also lost fewer video subscribers than estimated at 181,000, much improved from the 405,000-subscriber decline a year ago. Charter said its narrowing loss was ""driven by new and simplified pricing and packaging,"" like its bundle that gives cable subscribers access to the ad-supported tier of a number of streaming services. With today's surge, Charter shares moved into positive territory for 2025.";"News";"https://www.investopedia.com/charter-communications-stock-leads-s-and-p-500-as-subscriber-figures-top-estimates-11721972"
"2025-04-25 17:31:00";"Google Parent Alphabet Leads Adtech Stocks Higher on Signs of AI Success";"Shares of Google parent Alphabet (GOOGL) climbed Friday, leading shares of several other adtech and AI stocks higher, after showing signs of success with AI features. Alphabet's Class A shares jumped over 4% to just above $166, before paring gains in recent trading. Shares of several other tech companies in digital advertising that use AI tools also gained, including Meta Platforms (META), Pinterest (PINS), Snap (SNAP), and AppLovin (APP). (ReadInvestopedia'slive coverage oftoday's market action here.) The Google parent reportedbetter-than-expected quarterly earningsThursday, with CEO Sundar Pichai telling investors Google Search growth was driven by ""engagement we're seeing with features like AI Overviews, which now has 1.5 billion users per month"" in just under a year since its launch. Several analysts, including those at Citi and Wedbush,boosted their price targetsfor the stock in the wake of the results, pointing to its AI potential. Bank of America analysts, who also raised their price target, said they believe Wall Street ""may be underappreciating"" opportunities tied to search features like AI Overviews and AI-driven cloud demand. That trend could suggest more growth for other companies with cloud and digital ad businesses, with several set to report earnings in the coming weeks. Snap is scheduled to report next Tuesday, with Meta and cloud giant Microsoft set to follow Wednesday, and Amazon on Thursday.AppLovin is scheduled to release results the following Wednesday, May 7, with Pinterest's report due a day later.";"News";"https://www.investopedia.com/google-parent-alphabet-leads-adtech-stocks-higher-on-signs-of-ai-success-11722133"
"2025-04-25 18:01:18";"Stocks Trigger '100% Accurate' Bullish Signal After 3-Day Rally";"The stock market just hit a milestone that some market watchers say is a sure sign of more gains ahead. Stocks on theNew York Stock Exchange (NYSE)on Thursday completed aZweig Breadth Thrust (ZBT), which is realized when the share of rising stocks increases from a moving average of less than 40% to more than 61.5% within a 10-day period. The rare occurrence, which has only been seen 19 times in the last 80 years, is considered a sign of increasing market momentum driven by broad bullishsentiment. ""This signal has been 100% accurate since WWII, with theS&P 500higher 6- and 12-months later every single time,"" according to Ryan Detrick, chief market strategist at Carson Group.Looking at the last 19 ZBT signals, the S&P 500 has averaged a 6-monthreturnof 14.8% and a 1-year return of 23.4%, according to Detrick. Stocks have rebounded from their""Liberation Day"" slumpamid optimism that the White House iseager to defuse tensionswith China, which the administration has slapped with tariffs totaling 145% this year. The S&P 500 wasup slightly on Fridayafter rising more than 1.5% in each of the last three sessions. Not everyone is sold on ZBT’s predictive power.Technical analystTom McClellan, in 2015, examined Breadth Thrusts between 1929 and 1934 and found them to be much less reliable bullish signals. The first signal in this period came in November 1930, and it did precede a strong upswing. ""But its bullish effect petered out after just a few months, and the bear market was back on,"" McClellan wrote. Over the next two years, four more Breadth Thrusts failed to break thebear market. ""It was only in April 1933 that there was finally a good signal that led to follow-on buying,"" McClellan said. But that signal was followed by two more in 1934 that didn’t come to much. McClellan was writing in 2015, when a ZBT signal was triggered just months after stocks hit a record high. ""I cannot offer much in the way of optimistic commentary about this current ZBT signal,"" McClellan wrote, ""especially since it has occurred at a point that appears to be the early stage of a newdowntrend."" Stocks did rise after that ZBT signal, but it was one of the weakest ZBT rallies on record, with the S&P 500 up just 1.4% and 7% over the next 6 and 12 months, respectively, according to Detrick's data.";"News";"https://www.investopedia.com/stocks-trigger-100-percent-accurate-bullish-signal-zweig-breadth-thrust-11722168"
"2025-04-25 18:37:26";"How Big Are Indian Family's Gold Holdings? Hint: It's More Than What's in Fort Knox";"Collectively, families across India have almost 25,000 tonnes of gold, making them the highest private owners of gold in the world. To put it in perspective, Indian families have a gold stash almost six times greater than the gold stored in Fort Knox. Gold serves various purposes in India. It is collected and kept as afinancial shieldshould economic turmoil arise, it is given as a gift at celebrations, and in rural areas, it takes the place of banking. As part of the cultural fabric, women collect gold jewelry, which is seen as a symbol of wealth, and it is often passed down from one generation to the next. And atweddings, gold jewelry is given to the bride, and gold bars are presented to the happy couple. Despite its importance in Indian life, there are restrictions on how much gold individuals can hold. According toincome taxlaws in India, married women are allowed to hold as much as 500 grams of gold. For unmarried women, this amount is lower, at 250 grams. Indian men may only hold up to 100 grams of gold. The total discovered gold in human history. In addition to its cultural importance in India, gold serves as a financial investment worldwide. It is often seen as an economic hedge when markets tumble. The price of gold as of April 25, 2025, is $3,305.70 per ounce. This is up from $2,331.71 per ounce in April 2024. Gold has been a solidinvestmentover the past 17 years. In April 2008, the price of gold was $1,354.54 per ounce, a triple-digit increase compared with today's price. However, gold is also a highly speculative asset with volatile price shifts and doesn't provide interest or dividends. Owning physical gold also comes with security and storage demands. Beyond owning bars or jewelry, gold investments can include exchange-traded funds (ETFs) and stocks in gold mining operations. Indian families, particularly Indian women, are large holders of gold. This precious metal has a significant cultural meaning for Indian people, as they gift gold at weddings and pass it down from generation to generation. Gold also serves as a financial means of protection in difficult economic times, as it does throughout the rest of the world.";"News";"https://www.investopedia.com/amount-of-indian-familys-gold-holdings-11703898"
"2025-04-25 19:38:31";"Watch These Alphabet Price Levels as Stock Rises After Strong Earnings Report";"Alphabet (GOOGL) shares rose Friday after the Google parent posted quarterly results thattopped Wall Street expectations amid AI-fueled search advertising growth. The tech giant, which also raised its quarterly dividend and upped its stockbuyback program, said AI integration into Google search had helped power ad growth, adding that features like AI Overview has driven user engagement. Alphabet reiterated its plans to spend$75 billionin capital expenditures this year, most of which is expected to go toward building out the company's AI infrastructure. Alphabet shares were up 1.8% at around $162 in late trading, as several analysts raised their price targets for the stock after the strong earnings report. Despite gains over the past week, the stock is 15% lower since the start of the year, due in part to worries over whether the company’s significant investment in AI infrastructure will pay off. Below, we analyze thetechnicalson Alphabet’s chart and identify crucial price levels that investors will likely be watching. Alphabet shares have trended lower within adescending channelthroughout most of this year, with the50-day moving average (MA)recently crossing below the 200-day MA to form an ominousdeath cross, a chart pattern that signal lower prices. However, the stock staged abreakoutabove the pattern’s upper trendline in Thursday’s trading session, which set the stage for today's post-earnings gain. Meanwhile, therelative strength index (RSI)flashes a neutral reading, but remains well belowoverboughtlevels, providing ample room for further upside. Let’s identify three crucial overhead areas on Alphabet’s chart where the shares may encounter overhead selling pressure and also locate a criticalsupport levelworth watching during possible retracements. The first area to monitor sits at $168. This location on the chart may provide overheadresistancenear a trendline that links multiplepeaks and troughson the chart extending back to late July last year. Buying above this level could see the price climb to around $182. Alphabet shares may run into sellers in this region near last November’sswing high, which closely aligns with theopening priceof astock gapin early December. The next overhead area of interest lies at the $196. Investors who have bought the stock at lower prices may look forprofit takingopportunities in this area near the upper range of aconsolidationperiod that formed on the chart throughout most of December and January. Finally, a loss of buyingmomentumcould see apullbackto around $155. Alphabet shares would likely attract buying interest in this location near yesterday’s breakout point, an area that also roughly lines up with the early August 2024swing low. The comments, opinions, and analyses expressed on Investopedia are for informational purposes only. Read ourwarranty and liability disclaimerfor more info. As of the date this article was written, the author does not own any of the above securities.";"News";"https://www.investopedia.com/watch-these-alphabet-price-levels-as-stock-rises-after-strong-earnings-report-11721874"
"2025-04-25 20:11:02";"Why Tesla Stock Just Had Its Best Week Since November";"Tesla (TSLA) stock posted its best week since November’s presidential election as investors looked ahead to a future with looser autonomous car regulations and a more focused CEO. Tesla shares soared nearly 10% on Friday after the Department of Transportation releasedan Automated Vehicle Frameworkintended to relax regulatory standards. The stock gained 18% this week, easily its best week this year and its biggest weekly gain since rising nearly 30% the weekDonald Trump was re-elected. Shares rose more than 4.5% on Tuesday amid a broad stock rally driven by optimism that the Trump administrationwill lower the steep tariff ratesit imposed earlier this month. The stock's ascent picked up pace on Wednesday after Musk assured investors that, starting in May, he wouldspend less timeleading President Trump’s Department of Government Efficiency, a position that investors worry has bothdistracted Muskanddamaged Tesla’s brand. Musk’s decision to re-focus on Tesla offset otherwisebleak quarterly results. The electric vehicle maker reported a 20% decline in automotive revenue, narrower margins, and a nearly 40% decline in adjusted earnings. It also declined to issue full-year guidance in light of the uncertainty surrounding tariffs and the overall economic outlook. In the near term, the company faces a bumpy road, with tariffs expected to drive up manufacturing costs and, in the event of a recession, curb consumer spending. The company could also struggle to shake its association with President Trump, whose unpopularity abroad has contributed toa sharp dropin Tesla sales even as total EV sales have risen. Analysts at several firms, including JPMorgan and Bank of America, lowered their estimates of Tesla’s full-year earnings after Tuesday’s disappointing numbers. At the same time, severalleft their price targets unchanged, reflecting Wall Street’s faith in Tesla’s ability to overcome near-term headwinds. Musk has said Tesla’s value—he has forecast it will be “the most valuable company in the worldand probably by a long shot”—has as much, if not more, to do with its development of AI, autonomous driving, and robotics than the electric vehicles that account for the bulk of its revenue today. On Tuesday’s earnings call, Muskreiterated some ambitious timelinesfor the rollout of self-driving cars, robotaxis, and humanoid robots.";"News";"https://www.investopedia.com/why-tesla-stock-just-had-its-best-week-since-november-musk-tsla-11722441"
"2025-04-25 20:36:21";"Electronic Arts Stock Works Its Way Back From January's Tumble";"Shares of video game maker Electronic Arts (EA) have fought their way back after plummeting earlier this year. Shares of EA finished Friday a bit under $147 as Oppenheimer analysts called for them to keep rising. Theinvestment bankraised its price target to $170 from $140 in a Friday note, well above the Visible Alpha average of Wall Street analysts near $144 and one of the highest around.The latest move has the shares roughly flat for the year, marking a climb off January lows below $120 driven bya worrisome outlook. Oppenheimer in part credited the new Premium Pass in the EA Sports FC franchise for its bullish outlook, as an analyst said in the note that the firm expects the feature to “provide incremental, multi-year bookings growth tailwind previously unexpected by investors.” The analysts said the pass has proven to be amonetizationtool that works for games like Fortnite, Call of Duty, Valorant, and Overwatch 2, as it is often incremental to other monetization models, like premium in-game items, and it gives developers more control over user engagement and in-game economy. Oppenheimer said its bullish estimate could prove to be too aggressive if the console-refresh cycle fails to meet investor expectations over the next few years, if sales of older games fall at a higher rate than their replacements' growth, or if EA can't continue to tightly manage itsoperating expenses. “While EA enjoys successful evergreen [video game] properties like Madden NFL and FIFA, future growth will suffer if consumer perception of microtransactions turns negative,” the report also said. Microtransactionsare transactions made electronically that allow gamers to make in-game purchases of items such as currency and loot boxes, and to tip players. Newer platforms such as Fortnite generaterevenuealmost entirely from microtransactions. EA is responsible for some of the most popular game franchises, including Battlefield, EA Sports, and The Sims. The company is expected to report fourth-quarter and full-yearearningson May 6.";"News";"https://www.investopedia.com/electronic-arts-stock-works-its-way-back-from-january-s-tumble-11722345"
"2025-04-25 21:19:49";"Nintendo Switch 2 Pre-Orders Are Hot Tickets After Tariff Delay";"Nintendo Switch 2 pre-orders are now live in the U.S. But will you be lucky enough to get one? Presales for Nintendo’s (NTDOY) newest gaming console, set to arrive June 5, started this week. The device is expected to be popular: The company warned gamers on X there could be significantly more demand than supply.(It was originally supposed to be available for pre-order Apr. 9, but the Japan-based companypushed backthe date amid tariff concerns.) Nintendo has allowed fans to register interest by signing into their My Nintendo accounts. The company says this method is available on a first-come, first-served basis, and only for registrants who have a Nintendo Switch Online membership with at least 12 months of paid membership and 50 total gameplay hours on the current Switch. Those who are chosen will receive an invitation to preorder via email, Nintendo said. Several big retailers, including Walmart (WMT), Best Buy (BBY), and Target (TGT), launched pre-sales Thursday. Many shoppers were reportedly met with outages, ""sold out"" messages, and other issues.GameStop (GME) experienced some website ""issues."" ""The excitement around this online preorder was incredible,"" a Walmart spokesperson said; the company sold out of its pre-order allocation. The other aforementioned retailers did not respond toInvestopedia'srequests for comment in time for publication. Membership-only store Costco (COST) sold out of its pre-order stock.Walmart-owned Sam's Club didn't have any available for presale, the company toldInvestopedia. Amazon doesn’t have listings up for the Nintendo Switch 2 or a bundle with the ""Mario Kart World"" game. Amazon did not respond toInvestopedia'squestion about whether it might offer presales in time for publication.";"News";"https://www.investopedia.com/nintendo-switch-2-pre-orders-went-live-thursday-many-shoppers-looking-for-one-were-met-with-outages-sold-out-messages-and-site-glitches-11722193"
"2025-04-25 21:23:29";"S&P 500 Gains and Losses Today: Charter Communications Soars as Subscriber Growth Impresses";"Major U.S. equity indexes ticked higher in the final trading session of the week following reports that China is evaluating a possible pause of tariffs on some U.S. goods. Meanwhile, President Trump indicated that tariffs on imports from China will remain in place unless the U.S. receives concessions from its major trading partner. The S&P 500 advanced 0.7%, extending its winning streak to four consecutive sessions, while another strong trading day for the tech sector helped lift the Nasdaq 1.3%. After fluctuating for most of the day, the Dow ended with a slight gain of less than 0.1%. Shares of cable, internet, and telephone services provider Charter Communications (CHTR) surged 11.4%, logging the S&P 500's top daily performance. In its first-quarter earnings report, released Friday morning, Charter reported better-than-expected revenues, although earnings per share (EPS) came in slightly below forecasts. The company alsotopped expectations for mobile phone line additionsand lost fewer video subscribers than anticipated, citing benefits from streamlined pricing and packaging of video services. Tesla (TSLA) shares jumped 9.8% after the Trump administration announced that it wouldloosen regulations on autonomous vehiclesin the U.S., aiming to help domestic firms compete with rivals in China. Friday closed out thebest week for Tesla stocksince November. The stock has risen in every session since CEO Elon Musk on Tuesday said he would scale back his government work and dedicate more time to Tesla, overshadowing adisappointing first-quarter earnings report. Internet services provider VeriSign (VRSN) topped first-quarter sales and profit estimates, and its shares powered 8% higher. The company also announced a cash dividend and increased its full-year guidance. An uptick in domain name registrations compared with the previous quarter helped underpin the strong results and upbeat forecast. First-quarter EPS posted by Erie Indemnity (ERIE) fell well shy of expectations, and shares of the insurance firm plunged 11.5%, dropping the most of any S&P 500 stock on Friday. Although revenue came in slightly ahead of forecasts, higher operational costs weighed on profitability. Shares of telecommunications giant T-Mobile US (TMUS) tumbled 11.2%. Although quarterly sales and profits exceeded consensus forecasts, T-Mobile reportedfewer-than-expected postpaid wireless subscriber additions, and its postpaidchurn rateticked higher year-over-year. The company's CEO also suggested that customers will have to pay more for their cell phones if tariffs result in higher prices. Insurance and professional services provider Aon (AON) missed quarterly revenue and EPS estimates, and its shares fell 8%. Increasing expenses, including debt and employee compensation costs, dragged down profits, while Aon's interest income dropped significantly from the previous year.";"News";"https://www.investopedia.com/s-and-p-500-gains-and-losses-today-chtr-tsla-vrsn-erie-tmus-aon-11722477"
