"Date and Timestamp";"Title";"Full Text";"Source";"Link"
"2025-04-27 08:04:48";"Angeles Investment Advisors LLC Lowers Position in NVIDIA Co. (NASDAQ:NVDA)";"  Angeles Investment Advisors LLC decreased its holdings in shares of  NVIDIA Co. (NASDAQ:NVDA – Free Report) by 33.5% during the fourth quarter, according to its most recent filing with the SEC. The firm owned 27,790 shares of the computer hardware maker’s stock after selling 13,976 shares during the period. NVIDIA accounts for about  0.2% of Angeles Investment Advisors LLC’s portfolio, making the stock its 27th largest position. Angeles Investment Advisors LLC’s holdings in NVIDIA were worth $3,732,000 as of its most recent SEC filing.  Several other large investors have also modified their holdings of the business. Clune & Associates LTD. purchased a new position in  NVIDIA during the fourth quarter valued at approximately $3,955,000.  Mountain Hill Investment Partners Corp. bought a new stake in  NVIDIA during the 4th quarter valued at $846,000.  McCollum Christoferson Group LLC increased its holdings in shares of  NVIDIA by 2.1% in the 4th quarter. McCollum Christoferson Group LLC now owns 15,218 shares of the computer hardware maker’s stock valued at $2,044,000 after acquiring an additional 318 shares during the period.  Crowley Wealth Management Inc. bought a new position in shares of  NVIDIA in the 4th quarter worth $581,000.  Finally, Cedar Wealth Management LLC lifted its stake in shares of  NVIDIA by 112.9% during the 4th quarter. Cedar Wealth Management LLC now owns 11,050 shares of the computer hardware maker’s stock worth $1,484,000 after purchasing an additional 5,860 shares during the last quarter. Institutional investors own  65.27% of the company’s stock.     Get NVIDIA alerts:    Insider Activity In other news, Director Aarti S. Shah sold 20,000 shares of NVIDIA stock in a transaction on Thursday, March 20th. The shares were sold at an average price of $118.42, for a total transaction of $2,368,400.00. Following the completion of the sale, the director now directly owns 53,208 shares of the company’s stock, valued at approximately $6,300,891.36. The trade was a 27.32 % decrease in their position. The transaction was disclosed in a document filed with the Securities & Exchange Commission, which is accessible through the SEC website. Also, CFO Colette Kress sold 66,660 shares of the stock in a transaction on Friday, March 21st. The shares were sold at an average price of $116.83, for a total value of $7,787,887.80. Following the completion of the transaction, the chief financial officer now directly owns 3,085,765 shares in the company, valued at $360,509,924.95. This trade represents a 2.11 % decrease in their position. The disclosure for this sale can be found here. In the last quarter, insiders sold 147,147 shares of company stock worth $17,133,207. 4.23% of the stock is currently owned by company insiders.  Analyst Ratings Changes        Want More Great Investing Ideas?  10 Stocks to Sell NOW! 3 Stocks to DOUBLE This Year The 10 Best Stocks to Own in 2023 7 Stocks to Buy and Hold Forever     							                   A number of brokerages have commented on NVDA. UBS Group  reiterated a “buy” rating on shares of NVIDIA in a report on Friday. HSBC lowered shares of NVIDIA from a “buy” rating to a “hold” rating and set a $120.00 price objective for the company. in a research note on Thursday, April 3rd. Tigress Financial  reaffirmed a “buy” rating on shares of NVIDIA in a report on Wednesday, February 26th. DZ Bank upgraded NVIDIA from a “hold” rating to a “strong-buy” rating in a report on Friday, February 28th. Finally, Piper Sandler  restated an “overweight” rating on shares of NVIDIA in a research note on Friday. Six equities research analysts have rated the stock with a hold rating, thirty-six have issued  a buy rating and two have given a strong buy rating to the company. According to MarketBeat, NVIDIA currently has a consensus rating of “Moderate Buy” and a consensus target price of $164.96. Read Our Latest Stock Analysis on NVDA NVIDIA Stock Up 4.3 % Shares of NVDA opened at $111.01 on Friday. The company has a debt-to-equity ratio of 0.13, a quick ratio of 3.64 and a current ratio of 4.10. The stock has a market capitalization of $2.71 trillion, a PE ratio of 43.69, a P/E/G ratio of 1.76 and a beta of 1.96. The company’s 50-day simple moving average is $113.21 and its 200-day simple moving average is $128.99. NVIDIA Co. has a 1 year low of $81.25 and a 1 year high of $195.95.  NVIDIA (NASDAQ:NVDA – Get Free Report) last issued its quarterly earnings results on Wednesday, February 26th. The computer hardware maker reported $0.89 EPS for the quarter, beating the consensus estimate of $0.84 by $0.05. The company had revenue of $39.33 billion during the quarter, compared to analysts’ expectations of $38.16 billion. NVIDIA had a net margin of 55.69% and a return on equity of 114.83%.  Analysts forecast that  NVIDIA Co. will post 2.77 earnings per share for the current fiscal year.  NVIDIA Dividend Announcement The business also recently declared a quarterly dividend, which was paid on Wednesday, April 2nd. Shareholders of record on Wednesday, March 12th were given a $0.01 dividend. This represents a $0.04 dividend on an annualized basis and a yield of 0.04%. The ex-dividend date of this dividend  was Wednesday, March 12th. NVIDIA’s dividend payout ratio  is currently 1.36%.  About NVIDIA  (Free Report) NVIDIA Corporation provides graphics and compute and networking solutions in the United States, Taiwan, China, Hong Kong, and internationally. The Graphics segment offers GeForce GPUs for gaming and PCs, the GeForce NOW game streaming service and related infrastructure, and solutions for gaming platforms; Quadro/NVIDIA RTX GPUs for enterprise workstation graphics; virtual GPU or vGPU software for cloud-based visual and virtual computing; automotive platforms for infotainment systems; and Omniverse software for building and operating metaverse and 3D internet applications. Read More  Five stocks we like better than NVIDIA How Investors Can Find the Best Cheap Dividend Stocks Markets Think Robinhood Earnings Could Send the Stock Up What Are Dividend Challengers? Churchill Downs Stock: Could Tariff Fears Dampen Derby Gains? What Are Trending Stocks? Trending Stocks Explained AT&T: Subscriber Growth & Buybacks Signal Bullish Turnaround   Want to see what other hedge funds are holding NVDA? Visit HoldingsChannel.com to get the latest 13F filings and insider trades for NVIDIA Co. (NASDAQ:NVDA – Free Report).        Receive News & Ratings for NVIDIA Daily - Enter your email address below to receive a concise daily summary of the latest news and analysts' ratings for NVIDIA and related companies with MarketBeat.com's FREE daily email newsletter.        ";"News";"https://www.etfdailynews.com/2025/04/27/angeles-investment-advisors-llc-lowers-position-in-nvidia-co-nasdaqnvda/"
"2025-04-27 08:04:49";"Meridian Wealth Partners LLC Sells 1,720 Shares of NVIDIA Co. (NASDAQ:NVDA)";"  Meridian Wealth Partners LLC trimmed its holdings in shares of  NVIDIA Co. (NASDAQ:NVDA – Free Report) by 7.0% in the fourth quarter, HoldingsChannel reports. The institutional investor  owned 22,794 shares of the computer hardware maker’s stock after selling 1,720 shares during the quarter. NVIDIA accounts for  0.5% of Meridian Wealth Partners LLC’s portfolio, making the stock its 26th biggest position. Meridian Wealth Partners LLC’s holdings in NVIDIA were worth $3,061,000 at the end of the most recent quarter.  Other large investors have also bought and sold shares of the company. Tacita Capital Inc acquired a new stake in shares of  NVIDIA in the 4th quarter valued at approximately $28,000.  Legend Financial Advisors Inc. bought a new stake in  NVIDIA in the fourth quarter valued at approximately $34,000.  Vision Financial Markets LLC acquired a new stake in  NVIDIA in the fourth quarter worth $38,000.  Luken Investment Analytics LLC bought a new position in shares of  NVIDIA during the fourth quarter worth $40,000.  Finally, Lowe Wealth Advisors LLC acquired a new position in shares of  NVIDIA in the 4th quarter valued at $46,000. 65.27% of the stock is currently owned by institutional investors and hedge funds.     Get NVIDIA alerts:    Analyst Upgrades and Downgrades Several analysts recently commented on NVDA shares. William Blair  reaffirmed an “outperform” rating on shares of NVIDIA in a research note on Thursday, March 20th. Raymond James  reiterated a “strong-buy” rating on shares of NVIDIA in a report on Wednesday, April 16th. Wedbush  reiterated an “outperform” rating and issued a $175.00 price objective on shares of NVIDIA in a research report on Wednesday, April 16th. KeyCorp  set a $190.00 target price on shares of NVIDIA in a report on Wednesday, March 19th. Finally, Citigroup  reiterated a “buy” rating on shares of NVIDIA in a report on Wednesday, April 16th. Six equities research analysts have rated the stock with a hold rating, thirty-six have issued  a buy rating and two have given a strong buy rating to the company. According to MarketBeat, the company  has an average rating of “Moderate Buy” and a consensus target price of $164.96.        Want More Great Investing Ideas?  10 Stocks to Sell NOW! 3 Stocks to DOUBLE This Year The 10 Best Stocks to Own in 2023 7 Stocks to Buy and Hold Forever    Get Our Latest Report on NVDA NVIDIA Stock Performance Shares of NASDAQ:NVDA opened at $111.01 on Friday. The company’s 50 day moving average price is $113.21 and its two-hundred day moving average price is $128.99. NVIDIA Co. has a 12-month low of $81.25 and a 12-month high of $195.95. The company has a quick ratio of 3.64, a current ratio of 4.10 and a debt-to-equity ratio of 0.13. The firm has a market cap of $2.71 trillion, a PE ratio of 43.69, a PEG ratio of 1.76 and a beta of 1.96.  NVIDIA (NASDAQ:NVDA – Get Free Report) last released its earnings results on Wednesday, February 26th. The computer hardware maker reported $0.89 EPS for the quarter, beating the consensus estimate of $0.84 by $0.05. NVIDIA had a net margin of 55.69% and a return on equity of 114.83%. The firm had revenue of $39.33 billion for the quarter, compared to analyst estimates of $38.16 billion.  Equities research analysts predict that  NVIDIA Co. will post 2.77 earnings per share for the current year.  NVIDIA Announces Dividend The firm also recently announced a quarterly dividend, which was paid on Wednesday, April 2nd. Shareholders of record on Wednesday, March 12th were paid a dividend of $0.01 per share. This represents a $0.04 annualized dividend and a yield of 0.04%. The ex-dividend date  was Wednesday, March 12th. NVIDIA’s payout ratio is 1.36%.  Insider Activity at NVIDIA In related news, CFO Colette Kress sold 66,660 shares of the firm’s stock in a transaction that occurred on Friday, March 21st. The shares were sold at an average price of $116.83, for a total value of $7,787,887.80. Following the completion of the transaction, the chief financial officer now owns 3,085,765 shares in the company, valued at $360,509,924.95. This trade represents a 2.11 % decrease in their position. The sale was disclosed in a filing with the Securities & Exchange Commission, which is available through this hyperlink. Also, Director John Dabiri sold 2,663 shares of the business’s stock in a transaction on Monday, March 10th. The stock was sold at an average price of $110.00, for a total transaction of $292,930.00. Following the completion of the sale, the director now directly owns 17,279 shares in the company, valued at approximately $1,900,690. This represents a 13.35 % decrease in their position. The disclosure for this sale can be found here. Insiders sold a total of 147,147 shares of company stock valued at $17,133,207 in the last quarter. Insiders own  4.23% of the company’s stock.  NVIDIA Profile  (Free Report) NVIDIA Corporation provides graphics and compute and networking solutions in the United States, Taiwan, China, Hong Kong, and internationally. The Graphics segment offers GeForce GPUs for gaming and PCs, the GeForce NOW game streaming service and related infrastructure, and solutions for gaming platforms; Quadro/NVIDIA RTX GPUs for enterprise workstation graphics; virtual GPU or vGPU software for cloud-based visual and virtual computing; automotive platforms for infotainment systems; and Omniverse software for building and operating metaverse and 3D internet applications. Further Reading  Five stocks we like better than NVIDIA Asset Allocation Strategies in Volatile Markets Markets Think Robinhood Earnings Could Send the Stock Up The 3 Best Retail Stocks to Shop for in August Churchill Downs Stock: Could Tariff Fears Dampen Derby Gains? 3 REITs to Buy and Hold for the Long Term AT&T: Subscriber Growth & Buybacks Signal Bullish Turnaround   Want to see what other hedge funds are holding NVDA? Visit HoldingsChannel.com to get the latest 13F filings and insider trades for NVIDIA Co. (NASDAQ:NVDA – Free Report).        Receive News & Ratings for NVIDIA Daily - Enter your email address below to receive a concise daily summary of the latest news and analysts' ratings for NVIDIA and related companies with MarketBeat.com's FREE daily email newsletter.        ";"News";"https://www.etfdailynews.com/2025/04/27/meridian-wealth-partners-llc-sells-1720-shares-of-nvidia-co-nasdaqnvda/"
"2025-04-27 08:04:49";"Crowley Wealth Management Inc. Invests $581,000 in NVIDIA Co. (NASDAQ:NVDA)";"  Crowley Wealth Management Inc. acquired a new stake in  NVIDIA Co. (NASDAQ:NVDA – Free Report) during the 4th quarter, according to its most recent 13F filing with the Securities and Exchange Commission. The fund acquired 4,327 shares of the computer hardware maker’s stock, valued at approximately $581,000.  A number of other large investors also recently bought and sold shares of the stock. Hickory Point Bank & Trust purchased a new position in shares of  NVIDIA during the 4th quarter worth approximately $2,272,000.  Capital Performance Advisors LLP lifted its stake in  NVIDIA by 59.3% during the fourth quarter. Capital Performance Advisors LLP now owns 26,700 shares of the computer hardware maker’s stock worth $3,586,000 after purchasing an additional 9,944 shares in the last quarter.  Ethos Financial Group LLC boosted its position in shares of  NVIDIA by 24.1% during the fourth quarter. Ethos Financial Group LLC now owns 32,092 shares of the computer hardware maker’s stock worth $4,312,000 after buying an additional 6,241 shares during the period.  Metis Global Partners LLC grew its stake in shares of  NVIDIA by 3.6% in the fourth quarter. Metis Global Partners LLC now owns 1,464,826 shares of the computer hardware maker’s stock valued at $196,711,000 after buying an additional 50,978 shares in the last quarter.  Finally, Candriam S.C.A. raised its holdings in shares of  NVIDIA by 0.5% in the 4th quarter. Candriam S.C.A. now owns 7,061,058 shares of the computer hardware maker’s stock valued at $948,229,000 after buying an additional 35,684 shares during the period. Institutional investors and hedge funds own  65.27% of the company’s stock.     Get NVIDIA alerts:    NVIDIA Trading Up 4.3 % NASDAQ NVDA opened at $111.01 on Friday. NVIDIA Co. has a one year low of $81.25 and a one year high of $195.95. The firm has a market cap of $2.71 trillion, a PE ratio of 43.69, a P/E/G ratio of 1.76 and a beta of 1.96. The firm’s fifty day moving average is $113.21 and its two-hundred day moving average is $128.99. The company has a debt-to-equity ratio of 0.13, a quick ratio of 3.64 and a current ratio of 4.10.         Want More Great Investing Ideas?  10 Stocks to Sell NOW! 3 Stocks to DOUBLE This Year The 10 Best Stocks to Own in 2023 7 Stocks to Buy and Hold Forever     							                   NVIDIA (NASDAQ:NVDA – Get Free Report) last issued its quarterly earnings results on Wednesday, February 26th. The computer hardware maker reported $0.89 earnings per share (EPS) for the quarter, beating the consensus estimate of $0.84 by $0.05. NVIDIA had a return on equity of 114.83% and a net margin of 55.69%. The firm had revenue of $39.33 billion for the quarter, compared to analysts’ expectations of $38.16 billion.  Analysts expect that  NVIDIA Co. will post 2.77 earnings per share for the current year.  NVIDIA Dividend Announcement The business also recently declared a quarterly dividend, which was paid on Wednesday, April 2nd. Investors of record on Wednesday, March 12th were issued a dividend of $0.01 per share. This represents a $0.04 annualized dividend and a dividend yield of 0.04%. The ex-dividend date of this dividend  was Wednesday, March 12th. NVIDIA’s dividend payout ratio  is presently 1.36%.  Wall Street Analyst Weigh In Several research firms have weighed in on NVDA. Summit Insights downgraded NVIDIA from a “buy” rating to a “hold” rating in a research report on Thursday, February 27th. Needham & Company LLC  restated a “buy” rating and issued a $160.00 price objective on shares of NVIDIA in a report on Wednesday, March 19th. Morgan Stanley cut their target price on shares of NVIDIA from $162.00 to $160.00 and set an “overweight” rating on the stock in a research note on Friday. Cantor Fitzgerald  reissued an “overweight” rating and issued a $200.00 price target on shares of NVIDIA in a research report on Wednesday, April 16th. Finally, HSBC lowered NVIDIA from a “buy” rating to a “hold” rating and set a $120.00 price objective on the stock. in a research report on Thursday, April 3rd. Six analysts have rated the stock with a hold rating, thirty-six have assigned  a buy rating and two have issued  a strong buy rating to the stock. According to data from MarketBeat, NVIDIA currently has a consensus rating of “Moderate Buy” and an average price target of $164.96. Get Our Latest Stock Report on NVIDIA Insider Activity at NVIDIA In other news, insider Donald F. Robertson, Jr. sold 4,500 shares of the firm’s stock in a transaction that occurred on Friday, March 21st. The stock was sold at an average price of $116.80, for a total value of $525,600.00. Following the completion of the sale, the insider now directly owns 479,428 shares of the company’s stock, valued at $55,997,190.40. This trade represents a 0.93 % decrease in their position. The transaction was disclosed in a filing with the Securities & Exchange Commission, which is available through this hyperlink. Also, Director Robert K. Burgess sold 53,324 shares of NVIDIA stock in a transaction that occurred on Thursday, March 13th. The shares were sold at an average price of $115.49, for a total value of $6,158,388.76. Following the completion of the sale, the director now owns 251,044 shares in the company, valued at approximately $28,993,071.56. This trade represents a 17.52 % decrease in their ownership of the stock. The disclosure for this sale can be found here. Insiders have sold a total of 147,147 shares of company stock worth $17,133,207 in the last three months. Insiders own  4.23% of the company’s stock.  NVIDIA Company Profile  (Free Report) NVIDIA Corporation provides graphics and compute and networking solutions in the United States, Taiwan, China, Hong Kong, and internationally. The Graphics segment offers GeForce GPUs for gaming and PCs, the GeForce NOW game streaming service and related infrastructure, and solutions for gaming platforms; Quadro/NVIDIA RTX GPUs for enterprise workstation graphics; virtual GPU or vGPU software for cloud-based visual and virtual computing; automotive platforms for infotainment systems; and Omniverse software for building and operating metaverse and 3D internet applications. Recommended Stories  Five stocks we like better than NVIDIA Where to Find Earnings Call Transcripts Markets Think Robinhood Earnings Could Send the Stock Up What is the MACD Indicator and How to Use it in Your Trading Churchill Downs Stock: Could Tariff Fears Dampen Derby Gains? Find and Profitably Trade Stocks at 52-Week Lows AT&T: Subscriber Growth & Buybacks Signal Bullish Turnaround   Want to see what other hedge funds are holding NVDA? Visit HoldingsChannel.com to get the latest 13F filings and insider trades for NVIDIA Co. (NASDAQ:NVDA – Free Report).        Receive News & Ratings for NVIDIA Daily - Enter your email address below to receive a concise daily summary of the latest news and analysts' ratings for NVIDIA and related companies with MarketBeat.com's FREE daily email newsletter.        ";"News";"https://www.etfdailynews.com/2025/04/27/crowley-wealth-management-inc-invests-581000-in-nvidia-co-nasdaqnvda/"
